{
  "space": {
    "width": 29,
    "height": 62
  },
  "tweet": {
    "url": "http://yutoriou.com/comicou/",
    "hashtags": "コミック王",
    "related": "yutoriou"
  },
  "vertical_syms": [
    {
      "sym": "来賓",
      "left": 74,
      "tops": [
        129,
        194,
        260,
        326,
        455,
        521,
        586,
        652
      ]
    }
  ],
  "horizontal_syms": [
    {
      "sym": "来賓",
      "top": 66,
      "idx": 9,
      "lefts": [
        463,
        529
      ]
    }
  ]
}